{"apiVersion":"issue-phase/v1","bundleId":"issue-phase-capability-bundle-v1","capabilitySetSha256":"23e8e71cdfd9982c2f2d4a68b191324006bf730c2fb74445be7911a3c8258873","closure":{"algorithm":"sha256-raw-bytes","entries":[{"path":".claude/skills/issue-end/SKILL.md","sha256":"32ec42ffb1e0b6596406e584d65fae233081bbd96cb42d318d6feda7fd111026"},{"path":".claude/skills/issue-end/contracts/issue-end-phase-api-v1.json","sha256":"69d8c98c088f3dd354bdc7ba15be0d232252a1ef15dd667ba198d064371e5502"},{"path":".claude/skills/issue-end/schemas/issue-phase/capability-bundle-v1.schema.json","sha256":"e9a346060511cc633be507405aa30ebc1ba48551dbb5fc08c881b9335cdc3b3d"},{"path":".claude/skills/issue-end/schemas/issue-phase/phase-envelope-v1.schema.json","sha256":"e852e701d7df5705b2c128d131f68a94a5ddde9f1516d197216e38ec390e5b7f"},{"path":".claude/skills/issue-end/schemas/issue-phase/phase-protocol-v1.json","sha256":"1817df3d522e127d22c603ad32cc2b5f49c30c0ce9c6d151472ab4b24e2cf46d"},{"path":".claude/skills/issue-end/scripts/issue-common.mjs","sha256":"5510284fbdcebc1b20990fdcc495398b428b8cab1d1ce228f45fe97f93fa48c2"},{"path":".claude/skills/issue-end/scripts/issue-docs.mjs","sha256":"77e754b661e372303bec4245e993de5937462ca6bf0869b85d83d410060c3c05"},{"path":".claude/skills/issue-end/scripts/issue-end.mjs","sha256":"ef4f3a30a36408029b76ecfa30731d9a5192fe7f5dca62dd41fd29b111b33afc"},{"path":".claude/skills/issue-end/scripts/issue-media.mjs","sha256":"1da1c178cecbb427d8496264d3a9e1760a0508e82826c333eec68ca6202dc807"},{"path":".claude/skills/issue-end/scripts/issue-phase-contract.mjs","sha256":"fe2a17bb811ec2b04ae7b07cdbc1f805a583a71c45d94a3b206a8a3b0fa528ad"},{"path":".claude/skills/issue-end/scripts/issue-tracker.mjs","sha256":"2224c54a3a50fda7260f30f77f3fee6211aa1cf62a875f631cac507b3fd02a19"},{"path":".claude/skills/issue-merge/SKILL.md","sha256":"a5ca8524b230373c50865f8bbf03cd34c294c7d591aaf99585fcbac769493494"},{"path":".claude/skills/issue-merge/contracts/issue-merge-phase-api-v1.json","sha256":"5b0d9f59173081ec54d5f073aaf94c97d3eb41e730c4746470109936979cbc7c"},{"path":".claude/skills/issue-merge/schemas/issue-phase/capability-bundle-v1.schema.json","sha256":"e9a346060511cc633be507405aa30ebc1ba48551dbb5fc08c881b9335cdc3b3d"},{"path":".claude/skills/issue-merge/schemas/issue-phase/phase-envelope-v1.schema.json","sha256":"e852e701d7df5705b2c128d131f68a94a5ddde9f1516d197216e38ec390e5b7f"},{"path":".claude/skills/issue-merge/schemas/issue-phase/phase-protocol-v1.json","sha256":"1817df3d522e127d22c603ad32cc2b5f49c30c0ce9c6d151472ab4b24e2cf46d"},{"path":".claude/skills/issue-merge/scripts/issue-common.mjs","sha256":"5510284fbdcebc1b20990fdcc495398b428b8cab1d1ce228f45fe97f93fa48c2"},{"path":".claude/skills/issue-merge/scripts/issue-docs.mjs","sha256":"77e754b661e372303bec4245e993de5937462ca6bf0869b85d83d410060c3c05"},{"path":".claude/skills/issue-merge/scripts/issue-media.mjs","sha256":"1da1c178cecbb427d8496264d3a9e1760a0508e82826c333eec68ca6202dc807"},{"path":".claude/skills/issue-merge/scripts/issue-merge-phase.mjs","sha256":"a14b031dba27673debb1e444d51fcfe4ea8e9c67703f5d68129bc35024766d62"},{"path":".claude/skills/issue-merge/scripts/issue-merge.mjs","sha256":"01135722b3163073bb1fa17f5c5a8d4a722c87162846f01b7173ee5a0ac9f13f"},{"path":".claude/skills/issue-merge/scripts/issue-phase-contract.mjs","sha256":"fe2a17bb811ec2b04ae7b07cdbc1f805a583a71c45d94a3b206a8a3b0fa528ad"},{"path":".claude/skills/issue-merge/scripts/issue-tracker.mjs","sha256":"2224c54a3a50fda7260f30f77f3fee6211aa1cf62a875f631cac507b3fd02a19"},{"path":".claude/skills/issue-start/SKILL.md","sha256":"3ee53d13d0d1a62b374a7d4435c2cf3e9f847d597501a79b4b820cd723a6cdd0"},{"path":".claude/skills/issue-start/contracts/issue-start-phase-api-v1.json","sha256":"ee25044736c30492196ba1f37fe2334ccba0d40e5c79c7e1f55e0b1e9e0fe1c1"},{"path":".claude/skills/issue-start/schemas/issue-phase/capability-bundle-v1.schema.json","sha256":"e9a346060511cc633be507405aa30ebc1ba48551dbb5fc08c881b9335cdc3b3d"},{"path":".claude/skills/issue-start/schemas/issue-phase/phase-envelope-v1.schema.json","sha256":"e852e701d7df5705b2c128d131f68a94a5ddde9f1516d197216e38ec390e5b7f"},{"path":".claude/skills/issue-start/schemas/issue-phase/phase-protocol-v1.json","sha256":"1817df3d522e127d22c603ad32cc2b5f49c30c0ce9c6d151472ab4b24e2cf46d"},{"path":".claude/skills/issue-start/scripts/issue-common.mjs","sha256":"5510284fbdcebc1b20990fdcc495398b428b8cab1d1ce228f45fe97f93fa48c2"},{"path":".claude/skills/issue-start/scripts/issue-docs.mjs","sha256":"77e754b661e372303bec4245e993de5937462ca6bf0869b85d83d410060c3c05"},{"path":".claude/skills/issue-start/scripts/issue-media.mjs","sha256":"1da1c178cecbb427d8496264d3a9e1760a0508e82826c333eec68ca6202dc807"},{"path":".claude/skills/issue-start/scripts/issue-phase-contract.mjs","sha256":"fe2a17bb811ec2b04ae7b07cdbc1f805a583a71c45d94a3b206a8a3b0fa528ad"},{"path":".claude/skills/issue-start/scripts/issue-start-phase.mjs","sha256":"e64632a89ba472de40297ebcc6612276bc5c32ecd72919d053942f86493452bc"},{"path":".claude/skills/issue-start/scripts/issue-start.mjs","sha256":"3bf5cc06b79491b9179b4a5a5e128e9984ee416991b8537162989f4cb1446cd3"},{"path":".claude/skills/issue-start/scripts/issue-tracker.mjs","sha256":"2224c54a3a50fda7260f30f77f3fee6211aa1cf62a875f631cac507b3fd02a19"},{"path":".codex/skills/issue-end/SKILL.md","sha256":"32ec42ffb1e0b6596406e584d65fae233081bbd96cb42d318d6feda7fd111026"},{"path":".codex/skills/issue-end/contracts/issue-end-phase-api-v1.json","sha256":"69d8c98c088f3dd354bdc7ba15be0d232252a1ef15dd667ba198d064371e5502"},{"path":".codex/skills/issue-end/schemas/issue-phase/capability-bundle-v1.schema.json","sha256":"e9a346060511cc633be507405aa30ebc1ba48551dbb5fc08c881b9335cdc3b3d"},{"path":".codex/skills/issue-end/schemas/issue-phase/phase-envelope-v1.schema.json","sha256":"e852e701d7df5705b2c128d131f68a94a5ddde9f1516d197216e38ec390e5b7f"},{"path":".codex/skills/issue-end/schemas/issue-phase/phase-protocol-v1.json","sha256":"1817df3d522e127d22c603ad32cc2b5f49c30c0ce9c6d151472ab4b24e2cf46d"},{"path":".codex/skills/issue-end/scripts/issue-common.mjs","sha256":"5510284fbdcebc1b20990fdcc495398b428b8cab1d1ce228f45fe97f93fa48c2"},{"path":".codex/skills/issue-end/scripts/issue-docs.mjs","sha256":"77e754b661e372303bec4245e993de5937462ca6bf0869b85d83d410060c3c05"},{"path":".codex/skills/issue-end/scripts/issue-end.mjs","sha256":"ef4f3a30a36408029b76ecfa30731d9a5192fe7f5dca62dd41fd29b111b33afc"},{"path":".codex/skills/issue-end/scripts/issue-media.mjs","sha256":"1da1c178cecbb427d8496264d3a9e1760a0508e82826c333eec68ca6202dc807"},{"path":".codex/skills/issue-end/scripts/issue-phase-contract.mjs","sha256":"fe2a17bb811ec2b04ae7b07cdbc1f805a583a71c45d94a3b206a8a3b0fa528ad"},{"path":".codex/skills/issue-end/scripts/issue-tracker.mjs","sha256":"2224c54a3a50fda7260f30f77f3fee6211aa1cf62a875f631cac507b3fd02a19"},{"path":".codex/skills/issue-merge/SKILL.md","sha256":"a5ca8524b230373c50865f8bbf03cd34c294c7d591aaf99585fcbac769493494"},{"path":".codex/skills/issue-merge/contracts/issue-merge-phase-api-v1.json","sha256":"5b0d9f59173081ec54d5f073aaf94c97d3eb41e730c4746470109936979cbc7c"},{"path":".codex/skills/issue-merge/schemas/issue-phase/capability-bundle-v1.schema.json","sha256":"e9a346060511cc633be507405aa30ebc1ba48551dbb5fc08c881b9335cdc3b3d"},{"path":".codex/skills/issue-merge/schemas/issue-phase/phase-envelope-v1.schema.json","sha256":"e852e701d7df5705b2c128d131f68a94a5ddde9f1516d197216e38ec390e5b7f"},{"path":".codex/skills/issue-merge/schemas/issue-phase/phase-protocol-v1.json","sha256":"1817df3d522e127d22c603ad32cc2b5f49c30c0ce9c6d151472ab4b24e2cf46d"},{"path":".codex/skills/issue-merge/scripts/issue-common.mjs","sha256":"5510284fbdcebc1b20990fdcc495398b428b8cab1d1ce228f45fe97f93fa48c2"},{"path":".codex/skills/issue-merge/scripts/issue-docs.mjs","sha256":"77e754b661e372303bec4245e993de5937462ca6bf0869b85d83d410060c3c05"},{"path":".codex/skills/issue-merge/scripts/issue-media.mjs","sha256":"1da1c178cecbb427d8496264d3a9e1760a0508e82826c333eec68ca6202dc807"},{"path":".codex/skills/issue-merge/scripts/issue-merge-phase.mjs","sha256":"a14b031dba27673debb1e444d51fcfe4ea8e9c67703f5d68129bc35024766d62"},{"path":".codex/skills/issue-merge/scripts/issue-merge.mjs","sha256":"01135722b3163073bb1fa17f5c5a8d4a722c87162846f01b7173ee5a0ac9f13f"},{"path":".codex/skills/issue-merge/scripts/issue-phase-contract.mjs","sha256":"fe2a17bb811ec2b04ae7b07cdbc1f805a583a71c45d94a3b206a8a3b0fa528ad"},{"path":".codex/skills/issue-merge/scripts/issue-tracker.mjs","sha256":"2224c54a3a50fda7260f30f77f3fee6211aa1cf62a875f631cac507b3fd02a19"},{"path":".codex/skills/issue-start/SKILL.md","sha256":"3ee53d13d0d1a62b374a7d4435c2cf3e9f847d597501a79b4b820cd723a6cdd0"},{"path":".codex/skills/issue-start/contracts/issue-start-phase-api-v1.json","sha256":"ee25044736c30492196ba1f37fe2334ccba0d40e5c79c7e1f55e0b1e9e0fe1c1"},{"path":".codex/skills/issue-start/schemas/issue-phase/capability-bundle-v1.schema.json","sha256":"e9a346060511cc633be507405aa30ebc1ba48551dbb5fc08c881b9335cdc3b3d"},{"path":".codex/skills/issue-start/schemas/issue-phase/phase-envelope-v1.schema.json","sha256":"e852e701d7df5705b2c128d131f68a94a5ddde9f1516d197216e38ec390e5b7f"},{"path":".codex/skills/issue-start/schemas/issue-phase/phase-protocol-v1.json","sha256":"1817df3d522e127d22c603ad32cc2b5f49c30c0ce9c6d151472ab4b24e2cf46d"},{"path":".codex/skills/issue-start/scripts/issue-common.mjs","sha256":"5510284fbdcebc1b20990fdcc495398b428b8cab1d1ce228f45fe97f93fa48c2"},{"path":".codex/skills/issue-start/scripts/issue-docs.mjs","sha256":"77e754b661e372303bec4245e993de5937462ca6bf0869b85d83d410060c3c05"},{"path":".codex/skills/issue-start/scripts/issue-media.mjs","sha256":"1da1c178cecbb427d8496264d3a9e1760a0508e82826c333eec68ca6202dc807"},{"path":".codex/skills/issue-start/scripts/issue-phase-contract.mjs","sha256":"fe2a17bb811ec2b04ae7b07cdbc1f805a583a71c45d94a3b206a8a3b0fa528ad"},{"path":".codex/skills/issue-start/scripts/issue-start-phase.mjs","sha256":"e64632a89ba